{
  "user_data_model_version": "1.0",
  "payload_schema_version": 1,
  "account": {
    "user_data_model_version": "1.0",
    "payload_schema_version": 1,
    "record_type": "account",
    "id": "30000000-0000-4000-8000-000000000001",
    "workspace_id": "20000000-0000-4000-8000-000000000001",
    "payload": {
      "display_name": "Synthetic owner",
      "account_kind": "personal",
      "created_at_utc": "2026-10-24T12:00:00.000Z"
    }
  },
  "planning": {
    "user_data_model_version": "1.0",
    "payload_schema_version": 1,
    "workspace_id": "20000000-0000-4000-8000-000000000001",
    "account_id": "30000000-0000-4000-8000-000000000001",
    "content": {
      "user_data_model_version": "1.0",
      "payload_schema_version": 1,
      "workspace_id": "20000000-0000-4000-8000-000000000001",
      "collections": [
        {
          "user_data_model_version": "1.0",
          "payload_schema_version": 1,
          "record_type": "collection",
          "id": "20000000-0000-4000-8000-000000000002",
          "workspace_id": "20000000-0000-4000-8000-000000000001",
          "payload": {
            "title": "Synthetic board",
            "kind": "board",
            "icon": "square.stack.3d.up",
            "color": {
              "red": 0.1,
              "green": 0.3,
              "blue": 0.4,
              "legacy_token": null
            },
            "description": null,
            "archived": false,
            "board_appearance": {
              "banner_background": null,
              "collection_background": null,
              "list_background": null,
              "card_background": null,
              "card_detail": null,
              "card_title_color": null,
              "card_text_color": null,
              "add_item_text_color": null,
              "studio_surface": null,
              "studio_card_surface": null,
              "subtitle_italic": true
            },
            "preferred_focused_list_id": "20000000-0000-4000-8000-000000000003",
            "list_ids": [
              "20000000-0000-4000-8000-000000000003"
            ]
          }
        },
        {
          "user_data_model_version": "1.0",
          "payload_schema_version": 1,
          "record_type": "collection",
          "id": "30000000-0000-4000-8000-000000000010",
          "workspace_id": "20000000-0000-4000-8000-000000000001",
          "payload": {
            "title": "Template source",
            "kind": "board",
            "icon": "square.stack.3d.up",
            "color": {
              "red": 0.1,
              "green": 0.3,
              "blue": 0.4,
              "legacy_token": null
            },
            "description": null,
            "archived": false,
            "board_appearance": {
              "banner_background": null,
              "collection_background": null,
              "list_background": null,
              "card_background": null,
              "card_detail": null,
              "card_title_color": null,
              "card_text_color": null,
              "add_item_text_color": null,
              "studio_surface": null,
              "studio_card_surface": null,
              "subtitle_italic": true
            },
            "preferred_focused_list_id": "30000000-0000-4000-8000-000000000011",
            "list_ids": [
              "30000000-0000-4000-8000-000000000011"
            ]
          }
        }
      ],
      "lists": [
        {
          "user_data_model_version": "1.0",
          "payload_schema_version": 1,
          "record_type": "list",
          "id": "20000000-0000-4000-8000-000000000003",
          "workspace_id": "20000000-0000-4000-8000-000000000001",
          "payload": {
            "collection_id": "20000000-0000-4000-8000-000000000002",
            "title": "Today",
            "subtitle_override": "",
            "archived": false,
            "default_item_presentation": null,
            "appearance": null,
            "card_ids": [
              "20000000-0000-4000-8000-000000000004"
            ],
            "archived_card_ids": [
              "20000000-0000-4000-8000-000000000005"
            ]
          }
        },
        {
          "user_data_model_version": "1.0",
          "payload_schema_version": 1,
          "record_type": "list",
          "id": "30000000-0000-4000-8000-000000000011",
          "workspace_id": "20000000-0000-4000-8000-000000000001",
          "payload": {
            "collection_id": "30000000-0000-4000-8000-000000000010",
            "title": "Today",
            "subtitle_override": "",
            "archived": false,
            "default_item_presentation": null,
            "appearance": null,
            "card_ids": [
              "30000000-0000-4000-8000-000000000012"
            ],
            "archived_card_ids": []
          }
        }
      ],
      "cards": [
        {
          "user_data_model_version": "1.0",
          "payload_schema_version": 1,
          "record_type": "card",
          "id": "20000000-0000-4000-8000-000000000004",
          "workspace_id": "20000000-0000-4000-8000-000000000001",
          "payload": {
            "list_id": "20000000-0000-4000-8000-000000000003",
            "archived": false,
            "title": "Gym — synthetic sample",
            "is_divider": false,
            "completed": false,
            "editing_locked": false,
            "presentation": "card",
            "display_format": null,
            "description_override": "",
            "subtitle_override": null,
            "location": "Planet Fitness, 1971 S Koeller St, Oshkosh, WI 54902",
            "start": {
              "kind": "date_and_time",
              "local_date_time": "2026-10-24T07:00:00.000",
              "time_zone": "America/Chicago",
              "tzdb_version": "2025b",
              "utc_instant": "2026-10-24T12:00:00.000Z",
              "utc_offset": "-05:00",
              "occurrence": "unique"
            },
            "start_kind": "date_and_time",
            "due": {
              "kind": "date",
              "date": "2026-10-24"
            },
            "due_kind": "date",
            "shows_due_date_in_list": true,
            "source_created_at_utc": null,
            "checklists": [
              {
                "id": "20000000-0000-4000-8000-000000000040",
                "title": "All four action variants",
                "items": [
                  {
                    "id": "20000000-0000-4000-8000-000000000041",
                    "title": "Checklist action",
                    "completed": false,
                    "content": {
                      "kind": "standard"
                    },
                    "retained_detail": {
                      "id": "20000000-0000-4000-8000-000000000032",
                      "description": "Inactive detail retained on type change",
                      "checklists": [],
                      "comments": [
                        {
                          "id": "20000000-0000-4000-8000-000000000030",
                          "author": "Synthetic author",
                          "body": "Keep this text: café 🌿",
                          "source_created_at_utc": "2026-10-24T12:00:00.000Z",
                          "author_account_id": null
                        }
                      ]
                    },
                    "retained_card_id": "20000000-0000-4000-8000-000000000090",
                    "retained_url": "https://example.com/retained",
                    "linked_collection_id": "20000000-0000-4000-8000-000000000002"
                  },
                  {
                    "id": "20000000-0000-4000-8000-000000000042",
                    "title": "Checklist action",
                    "completed": false,
                    "content": {
                      "kind": "linked_card",
                      "card_id": "20000000-0000-4000-8000-000000000090"
                    },
                    "retained_detail": null,
                    "retained_card_id": null,
                    "retained_url": null,
                    "linked_collection_id": null
                  },
                  {
                    "id": "20000000-0000-4000-8000-000000000043",
                    "title": "Checklist action",
                    "completed": false,
                    "content": {
                      "kind": "action_detail",
                      "detail": {
                        "id": "20000000-0000-4000-8000-000000000045",
                        "description": "Editable detail",
                        "checklists": [
                          {
                            "id": "20000000-0000-4000-8000-000000000046",
                            "title": "Nested",
                            "items": [
                              {
                                "id": "20000000-0000-4000-8000-000000000047",
                                "title": "Checklist action",
                                "completed": false,
                                "content": {
                                  "kind": "standard"
                                },
                                "retained_detail": null,
                                "retained_card_id": null,
                                "retained_url": null,
                                "linked_collection_id": null
                              }
                            ]
                          }
                        ],
                        "comments": []
                      }
                    },
                    "retained_detail": null,
                    "retained_card_id": null,
                    "retained_url": null,
                    "linked_collection_id": null
                  },
                  {
                    "id": "20000000-0000-4000-8000-000000000044",
                    "title": "Checklist action",
                    "completed": false,